{
  "schema_version": "1.0.0",
  "generated_by": "skill-guidance",
  "target": {
    "path": "skill-zipper",
    "kind": "repo",
    "name": "skill-zipper",
    "maturity": "mature"
  },
  "intent": {
    "summary": "Restructure an existing Claude Code skill for token efficiency, reliability, and triggering accuracy via five lossless operations.",
    "in_scope": ["compress/encapsulate/enrich/harden/retrigger an existing SKILL.md", "token-cost analysis of a skill"],
    "out_of_scope": ["creating skills from scratch", "measuring output quality across runs", "general writing edits"],
    "primary_user": "agent invoked on an existing skill directory",
    "triggers_observed": ["my skill is too long", "split this skill", "reduce token usage", "audit this skill's structure"]
  },
  "altitude": "full",
  "altitude_rationale": "Mature, widely-reused meta-skill with a wide surface (5 operations, 9 rules modules); warrants full rigor.",
  "scorecard": [
    {"pillar": "design", "status": "present", "score": 2, "evidence": "Frontmatter has explicit Use-when + Do-NOT triggers; body is a numbered runbook with a Modules table.", "gaps": []},
    {"pillar": "research", "status": "partial", "score": 1, "evidence": "Pattern libraries (encapsulation/hardening) exist but are authored, not sourced to external evidence.", "gaps": ["no provenance for the pattern catalogues"]},
    {"pillar": "testing", "status": "present", "score": 2, "evidence": "diff_lossless.py + measure_tokens.py give deterministic verification; evals/ present.", "gaps": []},
    {"pillar": "tdd", "status": "partial", "score": 1, "evidence": "Verification scripts exist but tests are not written before edits.", "gaps": ["no failing-case-first workflow"]},
    {"pillar": "metrics", "status": "absent", "score": 0, "evidence": "No defined success rate or activation precision for the restructuring outcome.", "gaps": ["define before/after token delta as a tracked metric", "define a triggering-accuracy metric"]},
    {"pillar": "low_context_kb", "status": "present", "score": 2, "evidence": "SKILL.md is a thin orchestrator; 9 rules files loaded on demand.", "gaps": []},
    {"pillar": "lifecycle", "status": "absent", "score": 0, "evidence": "No version, changelog, or deprecation path in the skill.", "gaps": ["add a version + changelog"]}
  ],
  "overall_readiness": {
    "ratio": 0.57,
    "points": "8/14",
    "verdict": "candidate",
    "summary": "Strong design and low-context structure with deterministic verification; held back from industrial by missing metrics and lifecycle."
  },
  "comparables": [
    {"repo_id": "repo.addyosmani_agent-skills", "skill_path": "skills/using-agent-skills/SKILL.md", "what_to_borrow": "per-step verification gates and an anti-rationalization table to harden instructions"}
  ],
  "recommended_design": {
    "trigger": "Keep the existing Use-when/Do-NOT description; add 2 adjacent false-trigger cases vs skill-creator and skill-engineer.",
    "protocol": "Keep the 5-step runbook; add a metrics-capture step after verification.",
    "resources": ["existing rules/ pattern libraries"],
    "evidence_base": "Cite sources for the encapsulation/hardening pattern catalogues, or mark them as authored heuristics with a rationale.",
    "controls": ["already losslessness-gated via diff_lossless.py"],
    "tests": ["add a regression case for a known under-trigger", "keep diff_lossless as the contract"],
    "metrics": ["before/after always-loaded token delta", "triggering accuracy on a held-out eval set"],
    "lifecycle": "Add a version field + changelog; define when a restructure is breaking.",
    "adversarial_checklist": [
      "single >150-line SKILL.md block → Compress candidate emitted with destination rules file",
      "empty frontmatter description → Retrigger rewrite proposed without crash",
      "already minimal skill → no lossy change proposed; idempotent no-op allowed",
      "Harden rewrite changes intent → diff_lossless / review flags unresolved loss"
    ]
  },
  "prioritized_actions": [
    {"id": "A1", "pillar": "metrics", "action": "Define and record before/after always-loaded token delta and a held-out triggering-accuracy score.", "priority": "P0", "rationale": "Metrics absent caps the verdict at candidate."},
    {"id": "A2", "pillar": "lifecycle", "action": "Add a version + changelog and a breaking-change rule.", "priority": "P1", "rationale": "Enables safe evolution of a widely reused skill."},
    {"id": "A3", "pillar": "research", "action": "Add provenance to the pattern catalogues or mark them authored heuristics.", "priority": "P2", "rationale": "Improves trust without changing behavior."}
  ],
  "handoff": {
    "next_skill": "skill-engineer",
    "blocking_unknowns": ["Is a triggering-accuracy eval set already maintained elsewhere, or must the engineer build one?"]
  }
}
